issue,number,state,link
Update SQLite to the lastest sqlite-amalgamation-3340000,46152,closed,https://github.com/tensorflow/tensorflow/issues/46152
[tf.data] support ~/ alias for home dir in tf.data.Dataset.list_files,46151,closed,https://github.com/tensorflow/tensorflow/issues/46151
Rewrite 1D dilated convolution,46150,closed,https://github.com/tensorflow/tensorflow/issues/46150
"micro: in CONTRIBUTING.md, fix path to test script",46149,closed,https://github.com/tensorflow/tensorflow/issues/46149
"micro: in CONTRIBUTING.md, the path a test script is wrong",46148,closed,https://github.com/tensorflow/tensorflow/issues/46148
Failed to build wheel on MacOS Big Sur,46147,closed,https://github.com/tensorflow/tensorflow/issues/46147
Model loaded from a SavedModel format in a distribution strategy has weights whose names are not unique,46146,open,https://github.com/tensorflow/tensorflow/issues/46146
Pandas pct_change() function results in nan loss when training,46145,closed,https://github.com/tensorflow/tensorflow/issues/46145
TensorFlowLiteSwift build error in the Bazel project,46144,closed,https://github.com/tensorflow/tensorflow/issues/46144
Tensorflow and Keras installation issue,46143,closed,https://github.com/tensorflow/tensorflow/issues/46143
TensorFlow and TensorFlowLite model produces different results,46142,open,https://github.com/tensorflow/tensorflow/issues/46142
[tf.data service] test zipped datasets with different processing modes,46141,closed,https://github.com/tensorflow/tensorflow/issues/46141
Fix bool Where accumulation bug,46140,open,https://github.com/tensorflow/tensorflow/issues/46140
[tf.data] fix the example in DispatchServer docstring,46139,closed,https://github.com/tensorflow/tensorflow/issues/46139
Only use pthread_getname on glibc and FreeBSD,46138,closed,https://github.com/tensorflow/tensorflow/issues/46138
MetalDelegate.swift : Unexpected version number in 'available' attribute for non-specific platform '*',46137,closed,https://github.com/tensorflow/tensorflow/issues/46137
java.lang.IllegalArgumentException: Internal error: Cannot create interpreter: Didn't find op for builtin opcode 'CONV_2D' version '5',46136,open,https://github.com/tensorflow/tensorflow/issues/46136
"When activation='tanh' is used, the training gradient no drop",46135,closed,https://github.com/tensorflow/tensorflow/issues/46135
NotFoundError: No CPU devices are available in this process,46134,closed,https://github.com/tensorflow/tensorflow/issues/46134
Disable Eager Execution for the OPs related to Graphs and Sessions in Tensorflow 2.x,46133,closed,https://github.com/tensorflow/tensorflow/issues/46133
Android: Instantiating TFLite Interpreter with GPU delegate takes 2.5 seconds.,46132,open,https://github.com/tensorflow/tensorflow/issues/46132
TensorFlow,46131,closed,https://github.com/tensorflow/tensorflow/issues/46131
ValueError: Invalid checkpoint state loaded from,46130,closed,https://github.com/tensorflow/tensorflow/issues/46130
"""Table not initialized"" when loading model in Java",46129,closed,https://github.com/tensorflow/tensorflow/issues/46129
"This throws ERROR: features = tf.io.parse_example(..., features=make_parse_example_spec(columns))",46128,closed,https://github.com/tensorflow/tensorflow/issues/46128
Installing,46127,closed,https://github.com/tensorflow/tensorflow/issues/46127
Performance 5x degradation after converting numpy to tf.function equivalent,46126,closed,https://github.com/tensorflow/tensorflow/issues/46126
Unhandled Rejecting Error ~ Implicit Shape Can't Be a Fractional Number,46125,closed,https://github.com/tensorflow/tensorflow/issues/46125
Installation/Import issue. Help required.,46124,closed,https://github.com/tensorflow/tensorflow/issues/46124
Small last batches for TripletSemiHardLoss,46123,open,https://github.com/tensorflow/tensorflow/issues/46123
Update README.md,46122,closed,https://github.com/tensorflow/tensorflow/issues/46122
always got the time out when try to download upb file. ,46121,closed,https://github.com/tensorflow/tensorflow/issues/46121
Bazel out of memory at checking cache actions when building for ARMv8,46120,closed,https://github.com/tensorflow/tensorflow/issues/46120
Will TensorFlow update new optimizer?: Adabelief,46119,open,https://github.com/tensorflow/tensorflow/issues/46119
[Build] Building on Windows 10 fails with Bad address error,46118,open,https://github.com/tensorflow/tensorflow/issues/46118
Update version_check.bzl,46117,closed,https://github.com/tensorflow/tensorflow/issues/46117
How to convert this numpy to tf.function compatible code?,46116,closed,https://github.com/tensorflow/tensorflow/issues/46116
Add ReadVariableOp gradient to C++,46115,open,https://github.com/tensorflow/tensorflow/issues/46115
C++ Gradient for ReadVariableOp,46114,open,https://github.com/tensorflow/tensorflow/issues/46114
RPi Zero(ARMv6l) _FusedConv2D <no registered kernels>,46113,closed,https://github.com/tensorflow/tensorflow/issues/46113
ImageDataGenerator().batch_index starts from zero even though manually setting it,46112,closed,https://github.com/tensorflow/tensorflow/issues/46112
Resource exhausted:  OOM when allocating tensor with TF 2.4.0,46111,open,https://github.com/tensorflow/tensorflow/issues/46111
what CUDA 11 and cuDNN i have to install to use TF 2.4?,46110,closed,https://github.com/tensorflow/tensorflow/issues/46110
tensorflow lite model hangs in tflite.run in android emulator,46109,closed,https://github.com/tensorflow/tensorflow/issues/46109
Illegal instruction (core dumped) using tensorflow==2.4.0 with AVX instruction when importing,46108,closed,https://github.com/tensorflow/tensorflow/issues/46108
TFlite interpreter stuck after call to invoke(),46107,open,https://github.com/tensorflow/tensorflow/issues/46107
 Request: offer image-enlarging library that uses AI (TensorFlow),46106,open,https://github.com/tensorflow/tensorflow/issues/46106
Fix MobileNetV3 Preprocess,46105,closed,https://github.com/tensorflow/tensorflow/issues/46105
"Hello guys , does any one know how to solve this issue ? Thanks in advance!",46104,closed,https://github.com/tensorflow/tensorflow/issues/46104
ProfilerNotRunningError: Cannot stop profiling. No profiler is running. raised using profiler in tf.function,46103,closed,https://github.com/tensorflow/tensorflow/issues/46103
ImportError: cannot import name 'function_pb2' from 'tensorflow.core.framework' (unknown location),46102,closed,https://github.com/tensorflow/tensorflow/issues/46102
Building TF 2.3.1 with CUDA 11.1 fails with undefined protobuf symbol,46101,closed,https://github.com/tensorflow/tensorflow/issues/46101
"Exported TFLite Inference Graph (Step 1), but can't Convert to TFLite (Step 2)",46100,open,https://github.com/tensorflow/tensorflow/issues/46100
Expose class_id parameter on subclasses of SensitivitySpecificityBase,46099,closed,https://github.com/tensorflow/tensorflow/issues/46099
quant transpose convolution layer is not supported in nnapi acceleration,46098,closed,https://github.com/tensorflow/tensorflow/issues/46098
[INTEL MKL] Change order for remapper,46097,closed,https://github.com/tensorflow/tensorflow/issues/46097
Bert Preprocess Model not working on windows 10,46096,closed,https://github.com/tensorflow/tensorflow/issues/46096
Bump tensorflow from 2.0.0-beta1 to 2.4.0 in /tensorflow/lite/micro/examples/magic_wand/train,46095,closed,https://github.com/tensorflow/tensorflow/issues/46095
cuda_driver.cc:175] Check failed: err == cudaSuccess || err == cudaErrorInvalidValue Unexpected CUDA error: out of memory,46094,closed,https://github.com/tensorflow/tensorflow/issues/46094
When can we expect Tensorflow builds with Cuda 11.1 or Cuda 11.2?,46093,open,https://github.com/tensorflow/tensorflow/issues/46093
Wrong output dimension calculation of StrideSlice operation on TensorFlow Lite.,46092,closed,https://github.com/tensorflow/tensorflow/issues/46092
Missing functions from TF 2.4 vs TF 2.3 (tf.keras.backend),46091,closed,https://github.com/tensorflow/tensorflow/issues/46091
call() missing 1 required positional argument,46090,closed,https://github.com/tensorflow/tensorflow/issues/46090
Big SparseTensor constant and Datasets either turn into a large graph or a slow execution.,46089,open,https://github.com/tensorflow/tensorflow/issues/46089
ImportError: DLL load failed: A dynamic link library (DLL) initialization routine failed.,46088,closed,https://github.com/tensorflow/tensorflow/issues/46088
Newline after printing ConfigError in configuration,46087,closed,https://github.com/tensorflow/tensorflow/issues/46087
dlerror: cusparse64_11.dll not found. Cannot detetct GPU.,46086,closed,https://github.com/tensorflow/tensorflow/issues/46086
Cherry-pick: Lazy load estimator instead of using virtual pip package,46085,closed,https://github.com/tensorflow/tensorflow/issues/46085
u-net always not able to run in a single delegate,46084,closed,https://github.com/tensorflow/tensorflow/issues/46084
ESP32-EYE person_detection example will not build,46083,open,https://github.com/tensorflow/tensorflow/issues/46083
undefined symbol: _ZN6tflite12tensor_utils27NeonSymmetricQuantizeFloatsEPKfiPaPfS4_S4_,46082,closed,https://github.com/tensorflow/tensorflow/issues/46082
Is there have API to automatically calculate #flops (e.g. like flop_counter in pytorch) in tensorflow2?,46081,closed,https://github.com/tensorflow/tensorflow/issues/46081
[RNN] only LSTM not working,46080,open,https://github.com/tensorflow/tensorflow/issues/46080
benchmark_model build failed,46079,open,https://github.com/tensorflow/tensorflow/issues/46079
tensorflow.math.abs crashes Python on Windows,46078,closed,https://github.com/tensorflow/tensorflow/issues/46078
Assigning values to variables in Tensorflow graphs using the C API,46077,open,https://github.com/tensorflow/tensorflow/issues/46077
"Receiving the error: ""ValueError: Input 0 of layer sequential_8 is incompatible with the layer: expected axis -1 of input shape to have value 8 but received input with shape (None, 7, 169)""",46076,closed,https://github.com/tensorflow/tensorflow/issues/46076
"fix static path for find_cuda_config.py script, so tensorflow with cuda can be installed outside master directory.",46075,closed,https://github.com/tensorflow/tensorflow/issues/46075
Are there any excellent github projects on action recognition implemented by TF2?,46074,closed,https://github.com/tensorflow/tensorflow/issues/46074
Cannot quantize part of a model,46073,open,https://github.com/tensorflow/tensorflow/issues/46073
installing Keras package with tensorflow 2.3.1,46072,closed,https://github.com/tensorflow/tensorflow/issues/46072
How the parameters of decay_rate & decay_steps are taken into consideration while computing InverseTimeDecay(),46071,open,https://github.com/tensorflow/tensorflow/issues/46071
Make `TextVectorization` support pickling,46070,open,https://github.com/tensorflow/tensorflow/issues/46070
No matching distribution found during installation suing dockerfile,46069,closed,https://github.com/tensorflow/tensorflow/issues/46069
Error when build plugin,46068,closed,https://github.com/tensorflow/tensorflow/issues/46068
"Data input pipeline does not implement Batch for ""from_tensor_slices(dict(df))""",46067,closed,https://github.com/tensorflow/tensorflow/issues/46067
Input pipe line with consuming CSV data (dictionary object) does not implement Batch,46066,closed,https://github.com/tensorflow/tensorflow/issues/46066
Support Relu activation function with CUDA cuDNN gpu accleeration  instead of just tanh,46065,open,https://github.com/tensorflow/tensorflow/issues/46065
Wrong casting (mixed precision) in attention layers,46064,closed,https://github.com/tensorflow/tensorflow/issues/46064
Fix conv layer for partially unknown spatial shape,46063,closed,https://github.com/tensorflow/tensorflow/issues/46063
Modularize and consolidate the Docker images for downstream usage,46062,open,https://github.com/tensorflow/tensorflow/issues/46062
Error during converting the OpenNMT-tf model to TensorFlow Lite,46061,open,https://github.com/tensorflow/tensorflow/issues/46061
Propagate optional argv to benchmarks_main,46060,closed,https://github.com/tensorflow/tensorflow/issues/46060
Refactor flatbuffer_conversions for operators POW and ZEROS_LIKE,46059,closed,https://github.com/tensorflow/tensorflow/issues/46059
micro: port op POW from Lite,46058,closed,https://github.com/tensorflow/tensorflow/issues/46058
Refactor flatbuffer_conversions for operators WHERE and ZEROS_LIKE,46057,closed,https://github.com/tensorflow/tensorflow/issues/46057
Bug: Converting quantized Keras models to TFLite,46054,open,https://github.com/tensorflow/tensorflow/issues/46054
Ability to parse non-Example protos without Eager Execution,46052,open,https://github.com/tensorflow/tensorflow/issues/46052
micro: port op ZEROS_LIKE from lite,46049,closed,https://github.com/tensorflow/tensorflow/issues/46049
micro: port op WHERE from lite,46048,closed,https://github.com/tensorflow/tensorflow/issues/46048
"    pointclouds_pl = tf.placeholder(tf.float32, shape=(batch_size, num_point, 3)) AttributeError: module 'tensorflow' has no attribute 'placeholder'",46047,closed,https://github.com/tensorflow/tensorflow/issues/46047
Pylint upgrade 2.6.2,46046,closed,https://github.com/tensorflow/tensorflow/issues/46046
[r2.4 cherry-pick]: fix `modular_filesystem` call itself,46045,closed,https://github.com/tensorflow/tensorflow/issues/46045
How to run tensorflow 2.4.0 on ARM Mac using Rosetta 2,46044,open,https://github.com/tensorflow/tensorflow/issues/46044
RTX 3060 Ti is approximately x1.5 slower compared to RTX 2080 Super,46043,closed,https://github.com/tensorflow/tensorflow/issues/46043
Tensorflow related error when deploying shiny app on shinyapps.io,46042,closed,https://github.com/tensorflow/tensorflow/issues/46042
keras can't save model when useing featurecolumns embding,46041,closed,https://github.com/tensorflow/tensorflow/issues/46041
Remove extraneous expand_nonconcat_dims from doc string of tf.sparse.concat,46040,closed,https://github.com/tensorflow/tensorflow/issues/46040
Try to upgrade gast to 0.4.0,46039,closed,https://github.com/tensorflow/tensorflow/issues/46039
Error retrieving driver version: Unimplemented: kernel reported driver version not implemented on Windows,46038,closed,https://github.com/tensorflow/tensorflow/issues/46038
tensorflow 1.15.4 contrib.slim.python.slim.nets,46037,closed,https://github.com/tensorflow/tensorflow/issues/46037
Tensorflow crashes when running the profiler with CUDA 11,46036,open,https://github.com/tensorflow/tensorflow/issues/46036
map_fn can't generate ragged tensor on arbitrary dimension,46035,open,https://github.com/tensorflow/tensorflow/issues/46035
Error when build TF 1.13.2 from the source,46034,closed,https://github.com/tensorflow/tensorflow/issues/46034
AttributeError: 'tensorflow.python.framework.ops.EagerTensor' object has no attribute 'is_fully_defined',46032,closed,https://github.com/tensorflow/tensorflow/issues/46032
dataset_fn() must return a tf.data.Dataset when using a tf.distribute.Strategy.,46031,closed,https://github.com/tensorflow/tensorflow/issues/46031
I need to pass a buffer in the tensorFlow library when the buffer is of the type byteArray,46030,open,https://github.com/tensorflow/tensorflow/issues/46030
 java.lang.NoClassDefFoundError: Failed resolution of: Lorg/tensorflow/lite/schema/Model;,46029,closed,https://github.com/tensorflow/tensorflow/issues/46029
"When use  activation='tanh' , the training program will crash",46028,closed,https://github.com/tensorflow/tensorflow/issues/46028
gpu out of mempry,46027,closed,https://github.com/tensorflow/tensorflow/issues/46027
Extract a function for parsing op DEPTH_TO_SPACE,46026,closed,https://github.com/tensorflow/tensorflow/issues/46026
micro: port op DEPTH_TO_SPACE from lite,46025,open,https://github.com/tensorflow/tensorflow/issues/46025
Extract reference for op SPACE_TO_DEPTH to standalone header,46024,closed,https://github.com/tensorflow/tensorflow/issues/46024
AttributeError: module 'tensorflow_probability.python.bijectors' has no attribute 'Shift',46023,closed,https://github.com/tensorflow/tensorflow/issues/46023
Extract a function for parsing op SPACE_TO_DEPTH,46021,closed,https://github.com/tensorflow/tensorflow/issues/46021
Common location for portable bash helper functions / aliases,46020,closed,https://github.com/tensorflow/tensorflow/issues/46020
Upgrade grpcio to 1.34.0,46019,closed,https://github.com/tensorflow/tensorflow/issues/46019
Update Hello World README to point to new model,46018,closed,https://github.com/tensorflow/tensorflow/issues/46018
"class_id support for PrecisionAtRecall, RecallAtPrecision, and related metrics",46017,closed,https://github.com/tensorflow/tensorflow/issues/46017
TypeError: sample_chain() got an unexpected keyword argument 'seed',46016,closed,https://github.com/tensorflow/tensorflow/issues/46016
Cross-compilation for Raspberry Pi fails on macOS,46015,open,https://github.com/tensorflow/tensorflow/issues/46015
How do I pass an array of bytes instead of an array of shorts,46014,closed,https://github.com/tensorflow/tensorflow/issues/46014
Adjust error message of tf.debugging.assert_type,46013,closed,https://github.com/tensorflow/tensorflow/issues/46013
tf.function retracing,46012,closed,https://github.com/tensorflow/tensorflow/issues/46012
Fix md5sum command not found issue on mac,46011,closed,https://github.com/tensorflow/tensorflow/issues/46011
Internal error: Failed to run on the given Interpreter: tensorflow/lite/kernels/reduce.cc:534 ,46010,closed,https://github.com/tensorflow/tensorflow/issues/46010
ADDING DARK MODE TO TensorFlow WEBSITE,46009,closed,https://github.com/tensorflow/tensorflow/issues/46009
SparseTensor mul. broadcasting gradient fails,46008,closed,https://github.com/tensorflow/tensorflow/issues/46008
"Error on TPU V3-8 with XLA: RPC failed with status = ""Unavailable: Socket closed""",46007,open,https://github.com/tensorflow/tensorflow/issues/46007
"ConverterError: <unknown>:0: error: loc(""lstm_bias_lstm_17""): is not immutable (RNN)",46006,closed,https://github.com/tensorflow/tensorflow/issues/46006
windows 10 build failed (ERROR: An error occurred during the fetch of repository 'local_config_cuda':),46005,closed,https://github.com/tensorflow/tensorflow/issues/46005
Normalizing checkpoint path for Windows File System in Saver.py,46004,closed,https://github.com/tensorflow/tensorflow/issues/46004
keras.Model.fit error with 2.4 and TPUv3,46003,closed,https://github.com/tensorflow/tensorflow/issues/46003
TFlite Poor Performance on Pixel 3 CPU when channel not multiple of 4,46002,open,https://github.com/tensorflow/tensorflow/issues/46002
Weight Normalization layer doesn't work with mixed precision,46001,open,https://github.com/tensorflow/tensorflow/issues/46001
Incorrect conda dependency information for tensorflow-gpu,46000,open,https://github.com/tensorflow/tensorflow/issues/46000
Bug in Transpose Convolution Padding,45999,open,https://github.com/tensorflow/tensorflow/issues/45999
" When I use AndroidStudio to import Image Segementation TensorsorflowLite model, there is a problem...",45998,open,https://github.com/tensorflow/tensorflow/issues/45998
java.lang.NoClassDefFoundError: Failed resolution of: Lorg/tensorflow/lite/support/image/ColorSpaceType,45997,open,https://github.com/tensorflow/tensorflow/issues/45997
Add VERSION_INFO,45996,closed,https://github.com/tensorflow/tensorflow/issues/45996
micro: port operator DIV kernel from lite with test,45995,closed,https://github.com/tensorflow/tensorflow/issues/45995
TF 2.4.0 crashes on startup with IndexError assuming that sys.argv[0] exists when it may be hosted by C++ (regression from 2.3.1),45994,open,https://github.com/tensorflow/tensorflow/issues/45994
How to access operations of the tf graph from a keras model? (for tf 2.4.0),45993,open,https://github.com/tensorflow/tensorflow/issues/45993
from tensorflow.contrib.layers.python.layers.initializers import variance_scaling_initializer,45992,closed,https://github.com/tensorflow/tensorflow/issues/45992
Tensorflow 2.4 requires BMI2 CPU extension (AVX is not enough),45991,closed,https://github.com/tensorflow/tensorflow/issues/45991
How to read .bin file using Tensorflow C++ api?,45990,closed,https://github.com/tensorflow/tensorflow/issues/45990
Fix some message typos,45989,closed,https://github.com/tensorflow/tensorflow/issues/45989
cannot execute exe of tensorflow py compiled with pyinstaller,45988,open,https://github.com/tensorflow/tensorflow/issues/45988
Tensorflow 2.4  CUDA 11   CUDA_ERROR_LAUNCH_FAILED,45987,closed,https://github.com/tensorflow/tensorflow/issues/45987
TFLite Benchmark Binary Erroring with FastSpeech Model,45986,closed,https://github.com/tensorflow/tensorflow/issues/45986
"Install Error ""github.com/tensorflow/examples""",45985,closed,https://github.com/tensorflow/tensorflow/issues/45985
Parallel execution of ops on tensors in unstacked list ,45984,closed,https://github.com/tensorflow/tensorflow/issues/45984
Unrecognized DataType enum value 68 and crash in malloc,45983,open,https://github.com/tensorflow/tensorflow/issues/45983
Simplify GPU usage model,45982,closed,https://github.com/tensorflow/tensorflow/issues/45982
"Running custom tflite model, segfault only on CPU, tflite 2.4.0 built from sources",45981,closed,https://github.com/tensorflow/tensorflow/issues/45981
TF2.3; tensorflow.python.framework.errors_impl.UnknownError: Failed to rename; : Access is denied. ; Input/output error,45980,closed,https://github.com/tensorflow/tensorflow/issues/45980
tf.keras.preprocessing.image.save_img() flips dimensions of images created from tf.keras.preprocessing.image_dataset_from_directory(),45979,closed,https://github.com/tensorflow/tensorflow/issues/45979
TF 2.4: Metrics not recognized as stateful in ProgbarLogger callback,45978,open,https://github.com/tensorflow/tensorflow/issues/45978
MaskRCNN TensorFlow Lite Inference Issue. No output from TFLite Model.,45977,closed,https://github.com/tensorflow/tensorflow/issues/45977
" No OpKernel was registered to support Op 'VarHandleOp' used by {{node dense/kernel}}with these attrs: [shape=[1,1], shared_name=""dense/kernel"", _class=[""loc:@dense/kernel""], dtype=DT_FLOAT, container=""""]",45976,closed,https://github.com/tensorflow/tensorflow/issues/45976
tf.debugging.assert_type raising error for wrong reason,45975,closed,https://github.com/tensorflow/tensorflow/issues/45975
TensorflowLite Android OpenCL delegate may produce invalid Conv2D result,45974,open,https://github.com/tensorflow/tensorflow/issues/45974
"grpc 1.32.0 doesn't support python 3.9 in windows 10, dependency should be updated to 1.34.0",45973,closed,https://github.com/tensorflow/tensorflow/issues/45973
Android Benchmark tool Build Failed,45972,closed,https://github.com/tensorflow/tensorflow/issues/45972
Attempting to use uninitialized value ,45971,closed,https://github.com/tensorflow/tensorflow/issues/45971
Timeseries example does NOT address the core of prediction,45970,open,https://github.com/tensorflow/tensorflow/issues/45970
Apollo3 project upload issue ,45969,closed,https://github.com/tensorflow/tensorflow/issues/45969
Package build failure,45968,closed,https://github.com/tensorflow/tensorflow/issues/45968
"tflite android gpu delegate init error, what does it mean?  Init: MUL: 1x1088x1x1  cannot be reduced to linear.",45967,closed,https://github.com/tensorflow/tensorflow/issues/45967
sparse_categorical_crossentropy and temporal sample weight,45966,closed,https://github.com/tensorflow/tensorflow/issues/45966
Download dependent 404（Build did NOT complete successfully）,45965,closed,https://github.com/tensorflow/tensorflow/issues/45965
tf.data.Data.as_numpy_iterator() creates unnecessary copies,45964,open,https://github.com/tensorflow/tensorflow/issues/45964
NotFoundError: '_MklMatMul',45963,closed,https://github.com/tensorflow/tensorflow/issues/45963
on_epoch_end() being called multiple times when workers > 0,45962,open,https://github.com/tensorflow/tensorflow/issues/45962
Programm ends Drasicly,45961,closed,https://github.com/tensorflow/tensorflow/issues/45961
A long period of GPU/CPU idle time in timeline,45960,closed,https://github.com/tensorflow/tensorflow/issues/45960
Nontrainable Custom Convolution at the start of model,45959,closed,https://github.com/tensorflow/tensorflow/issues/45959
Performance discrepency in an integer quantized model ,45958,open,https://github.com/tensorflow/tensorflow/issues/45958
Is it possible to build tf2.4 with cuda 10.0?,45957,closed,https://github.com/tensorflow/tensorflow/issues/45957
Using Tensorflow 2.3 in r (conda environment) to reproduce the examples of Platypus R-package,45956,closed,https://github.com/tensorflow/tensorflow/issues/45956
Tf.contrib.layers.Bias_add fails to operate due to uninitialized value,45955,closed,https://github.com/tensorflow/tensorflow/issues/45955
AttributeError: module 'tensorflow._api.v1.config' has no attribute 'list_physical_devices',45954,closed,https://github.com/tensorflow/tensorflow/issues/45954
Tensorflow Lite speed -> mobile vs desktop,45953,closed,https://github.com/tensorflow/tensorflow/issues/45953
tf.read_file have different speed to read the same images,45952,closed,https://github.com/tensorflow/tensorflow/issues/45952
fix the hyperlink in the doc,45951,closed,https://github.com/tensorflow/tensorflow/issues/45951
"Tensorflow does not use the GPU during training with eager execution, despite manual activation",45950,closed,https://github.com/tensorflow/tensorflow/issues/45950
TFLiteTransferConverter (tfltransfer) for model personalization cannot convert a model on 'keras_model_head.py': AttributeError: 'list' object has no attribute 'values' line 51,45949,open,https://github.com/tensorflow/tensorflow/issues/45949
https://youtu.be/IGpHWo0ySBU,45948,closed,https://github.com/tensorflow/tensorflow/issues/45948
https://youtu.be/IGpHWo0ySBU,45947,closed,https://github.com/tensorflow/tensorflow/issues/45947
