issue,number,state,link
[Intel-MKL] Adding support to use Icelake compilation options.,45133,closed,https://github.com/tensorflow/tensorflow/issues/45133
Update r2.4 cmake,45132,closed,https://github.com/tensorflow/tensorflow/issues/45132
r2.4: Update CMake build rules of TFLite,45131,closed,https://github.com/tensorflow/tensorflow/issues/45131
r2.4: Update TFLite CMake build rules,45130,closed,https://github.com/tensorflow/tensorflow/issues/45130
[Intel-MKL] ICX changes.,45129,closed,https://github.com/tensorflow/tensorflow/issues/45129
[CherryPick:r2.4] Rename exec_tools to tools,45128,closed,https://github.com/tensorflow/tensorflow/issues/45128
Add build badge for community supported continuous build for Xtensa.,45127,closed,https://github.com/tensorflow/tensorflow/issues/45127
Update version numbers for TensorFlow 2.4.0-rc3,45126,closed,https://github.com/tensorflow/tensorflow/issues/45126
[CherryPick:r2.4]Change NCCL_PATCH to 6,45125,closed,https://github.com/tensorflow/tensorflow/issues/45125
[CherryPick:r2.4]Rename exec_tools to tools,45124,closed,https://github.com/tensorflow/tensorflow/issues/45124
Metadata writer for custom TFLite object detection model,45123,closed,https://github.com/tensorflow/tensorflow/issues/45123
[TF-TRT] Added an environment variable to user specified TRT Algorithm ID,45122,closed,https://github.com/tensorflow/tensorflow/issues/45122
Implementations 2/3 of LocallyConnected1D layer don't work with saved_model.save(),45121,closed,https://github.com/tensorflow/tensorflow/issues/45121
Missing wheels tagged for macosx_11_x,45120,open,https://github.com/tensorflow/tensorflow/issues/45120
Tflite Model gives same output for every input,45119,closed,https://github.com/tensorflow/tensorflow/issues/45119
[INTEL MKL]  Added mkl_einsum op,45118,open,https://github.com/tensorflow/tensorflow/issues/45118
INTEL MKL Added mkl_einsum_op implementation,45117,closed,https://github.com/tensorflow/tensorflow/issues/45117
[CherryPick:r2.4][tf.data] Making sure setting tf.data threading options does not prevent auto-sharding from using file-level sharding.,45116,closed,https://github.com/tensorflow/tensorflow/issues/45116
[INTEL MKL] MKL DNN 0.x code clean -- common_runtime and ops modules,45115,closed,https://github.com/tensorflow/tensorflow/issues/45115
GPU and CPU utilization slashed after first epoch using tf.data and tf.keras,45114,open,https://github.com/tensorflow/tensorflow/issues/45114
Documentation for using a private CocoaPod spec for TensorFlow Lite is not correct,45113,closed,https://github.com/tensorflow/tensorflow/issues/45113
Tensorflow 2.x can't feed data with non-uniform shapes to a multi-input multi-output model,45112,closed,https://github.com/tensorflow/tensorflow/issues/45112
[r2.4 cherry-pick] Include C logging API into part of the libtensorflow_framework.so,45111,closed,https://github.com/tensorflow/tensorflow/issues/45111
Perhaps TF graph connectivity issues in keras-based Model containing Masking layers,45110,open,https://github.com/tensorflow/tensorflow/issues/45110
Intermediate-level guide in Time Series Forecasting example,45109,open,https://github.com/tensorflow/tensorflow/issues/45109
[Intel MKL] Enabling Quantized Conv ops in native format mode,45108,open,https://github.com/tensorflow/tensorflow/issues/45108
[Intel MKL] Changes in common files to enable MKL Quantized ops with native format,45107,open,https://github.com/tensorflow/tensorflow/issues/45107
Error during building examples for ARC target in TFLM.,45106,closed,https://github.com/tensorflow/tensorflow/issues/45106
ValueError: Input tensors to a Functional must come from `tf.keras.Input`. Received: 0 (missing previous layer metadata).,45105,closed,https://github.com/tensorflow/tensorflow/issues/45105
Missing dependency on PowerPCCodeGen leads to undefined references in tf_to_kernel,45104,closed,https://github.com/tensorflow/tensorflow/issues/45104
TFLiteConverter.from_saved_model runs on an error,45103,closed,https://github.com/tensorflow/tensorflow/issues/45103
Added useful C++ symbols missing from the tensorflow DLL on windows,45102,closed,https://github.com/tensorflow/tensorflow/issues/45102
TFRecords writing and reading,45101,closed,https://github.com/tensorflow/tensorflow/issues/45101
C and Java perfomance differences under Android,45100,open,https://github.com/tensorflow/tensorflow/issues/45100
installation of any version on python 3.9 and installation of v1.x on python 3.8,45097,closed,https://github.com/tensorflow/tensorflow/issues/45097
How to save a keras.Model with an embedded hub.KerasLayer ?,45096,closed,https://github.com/tensorflow/tensorflow/issues/45096
Failed to build wheel on MacOS Big Sur,45095,closed,https://github.com/tensorflow/tensorflow/issues/45095
ModuleNotFoundError: No module named 'tensorflow.contrib.keras.python',45094,closed,https://github.com/tensorflow/tensorflow/issues/45094
AttributeError: 'TensorArray' object has no attribute 'mark_used' with tf.function,45093,open,https://github.com/tensorflow/tensorflow/issues/45093
manylinux2010 compatible libtensorflow for TF 2.x,45092,closed,https://github.com/tensorflow/tensorflow/issues/45092
Adding a Lite flag to tf.keras.applications.EfficientNetBX,45091,open,https://github.com/tensorflow/tensorflow/issues/45091
tf keras upsample2d operator produces wrong results on tflite conversion,45090,closed,https://github.com/tensorflow/tensorflow/issues/45090
Tensorflow 2. x not recognizing RTX 3090 GPU,45089,closed,https://github.com/tensorflow/tensorflow/issues/45089
worker go to endless loop when ps send a UnavailableError to worker.,45088,closed,https://github.com/tensorflow/tensorflow/issues/45088
Create makefile targets to expose file lists to enable separate scripting,45087,open,https://github.com/tensorflow/tensorflow/issues/45087
Create makefile targets to expose file lists to enable separate scripting,45086,open,https://github.com/tensorflow/tensorflow/issues/45086
Support SparseSegmentSum and SparseSegmentSumWithNumSegments on GPU,45085,open,https://github.com/tensorflow/tensorflow/issues/45085
Support SparseSegmentSum and SparseSegmentSumWithNumSegments on CUDA.,45084,closed,https://github.com/tensorflow/tensorflow/issues/45084
Which version of Protobuf do I need to compile the TensorFlow2.0 source code ？,45083,closed,https://github.com/tensorflow/tensorflow/issues/45083
mnasnet with squeeze and excite can not be quantized,45082,closed,https://github.com/tensorflow/tensorflow/issues/45082
Management of Gpu memory by fit method to avoid memory errors,45081,open,https://github.com/tensorflow/tensorflow/issues/45081
Fix typo in gradients.cc,45080,closed,https://github.com/tensorflow/tensorflow/issues/45080
Custom loss function always throws: TypeError: __init__() takes 1 positional argument but 3 were given,45079,closed,https://github.com/tensorflow/tensorflow/issues/45079
Model weights using the HDF5 format are not saved,45078,open,https://github.com/tensorflow/tensorflow/issues/45078
Model saving using the tf format uses the wrong TensorSpec for convolutions,45077,closed,https://github.com/tensorflow/tensorflow/issues/45077
Fixed multiple mistakes in XNNPACK delegate tensor type checking code,45076,closed,https://github.com/tensorflow/tensorflow/issues/45076
Fix wrong image_data_format() usage,45075,closed,https://github.com/tensorflow/tensorflow/issues/45075
"Deploy micro_speech to ESP32 , is running ,but do not get any output,how to modify?where is wrong",45074,open,https://github.com/tensorflow/tensorflow/issues/45074
Quantization differences from TensorFlow 1.9 to 2.3,45073,open,https://github.com/tensorflow/tensorflow/issues/45073
Physical devices not shown when I do have one,45072,closed,https://github.com/tensorflow/tensorflow/issues/45072
Missing DLL when importing (but which one?),45071,closed,https://github.com/tensorflow/tensorflow/issues/45071
v2.0.4rc2 CUBLAS_STATUS_NOT_INITIALIZED,45070,closed,https://github.com/tensorflow/tensorflow/issues/45070
AttributeError: module 'tensorflow.python.framework.ops' has no attribute 'register_tensor_conversion_function',45069,closed,https://github.com/tensorflow/tensorflow/issues/45069
2.4.0rc2 RTX3080 cuda 11.1 OP_REQUIRES failed at conv_ops_fused_impl.h:697 : Not found: No algorithm worked!,45068,closed,https://github.com/tensorflow/tensorflow/issues/45068
Trying to perform feature engineering and data processing in tf.data pipeline,45067,closed,https://github.com/tensorflow/tensorflow/issues/45067
Numpy and dataframe converter,45066,closed,https://github.com/tensorflow/tensorflow/issues/45066
importing tensorflow,45065,closed,https://github.com/tensorflow/tensorflow/issues/45065
importing tensorflow,45064,closed,https://github.com/tensorflow/tensorflow/issues/45064
KeyError when taking derivative to input of Conv2D with tf.function only,45063,open,https://github.com/tensorflow/tensorflow/issues/45063
Not working GeForce GTX 1070 on Tensorflow 2.3.1,45062,closed,https://github.com/tensorflow/tensorflow/issues/45062
Updated XNNPACK delegate readme,45061,closed,https://github.com/tensorflow/tensorflow/issues/45061
Add unit tests to losses utils and ensure RaggedTensor squeeze works.,45060,closed,https://github.com/tensorflow/tensorflow/issues/45060
build tensorflow_cc failed with cycle dependency graph,45059,open,https://github.com/tensorflow/tensorflow/issues/45059
Training model with VGGloss  on TPU gives tcmalloc warning and training time significantly increases.,45058,closed,https://github.com/tensorflow/tensorflow/issues/45058
Improve grappler layout optimizer to support 5D tensors [Resubmit],45057,closed,https://github.com/tensorflow/tensorflow/issues/45057
 Custom loop training of tacotron2 with MultiWorkerMirroredStrategy - Exceptions and failures when use MultiWorkerMirroredStrategy -,45056,closed,https://github.com/tensorflow/tensorflow/issues/45056
 W tensorflow/stream_executor/platform/default/dso_loader.cc:60] Could not load dynamic library 'cudart64_110.dll'; dlerror: cudart64_110.dll not found,45055,closed,https://github.com/tensorflow/tensorflow/issues/45055
"Concatenating sparse keras input layers results in None shape, preventing use in Dense layer",45054,closed,https://github.com/tensorflow/tensorflow/issues/45054
Add support for ragged tensors to tf.keras.layers.experimental.preprocessing.Resizing,45053,open,https://github.com/tensorflow/tensorflow/issues/45053
ifdef out known failing test cases for xtensa for svdf.,45052,closed,https://github.com/tensorflow/tensorflow/issues/45052
ifdef out the known failing test cases for FullyConnected for hifimini.,45051,closed,https://github.com/tensorflow/tensorflow/issues/45051
ifdef out known failing test cases for xtensa for depthwise_conv,45050,closed,https://github.com/tensorflow/tensorflow/issues/45050
docs(tflite): remove '--linkopt' flag,45049,closed,https://github.com/tensorflow/tensorflow/issues/45049
ifdef out known failing test cases for Conv2D for hifimini.,45048,closed,https://github.com/tensorflow/tensorflow/issues/45048
Use batch_size without modulo,45047,closed,https://github.com/tensorflow/tensorflow/issues/45047
add BiasAddGradient,45046,closed,https://github.com/tensorflow/tensorflow/issues/45046
XLA tests compiled even when XLA is not enabled,45045,closed,https://github.com/tensorflow/tensorflow/issues/45045
OP_REQUIRES failed at conv_ops.cc:1106 : Not found: No algorithm worked!,45044,open,https://github.com/tensorflow/tensorflow/issues/45044
use hooks to fine_tune in Estimator,45043,closed,https://github.com/tensorflow/tensorflow/issues/45043
Fix typo in reshape.cc,45042,closed,https://github.com/tensorflow/tensorflow/issues/45042
tf2.3  keras model can't save  big embedding:  tensorflow.SavedModel exceeds maximum protobuf size of 2GB,45041,closed,https://github.com/tensorflow/tensorflow/issues/45041
TFLu: Suppress compiler error for generated segfault,45040,closed,https://github.com/tensorflow/tensorflow/issues/45040
Fixed typo in documentation,45039,closed,https://github.com/tensorflow/tensorflow/issues/45039
[TFLite] Experimental new quantizer calculates the wrong scaling when the input range doesn't include 0,45038,closed,https://github.com/tensorflow/tensorflow/issues/45038
"tensorflow version 2.2.0 ;question:WARNING:tensorflow:6 out of the last 11 calls to <function Model.make_predict_function.<locals>.predict_function at 0x0000023B864321F8> triggered tf.function retracing. Tracing is expensive and the excessive number of tracings is likely due to passing python objects instead of tensors. Also, tf.function has experimental_relax_shapes=True option that relaxes argument shapes that can avoid unnecessary retracing. Please refer to https://www.tensorflow.org/tutorials/customization/performance#python_or_tensor_args and https://www.tensorflow.org/api_docs/python/tf/function for more details.",45037,closed,https://github.com/tensorflow/tensorflow/issues/45037
UnicodeDecodeError: 'utf-8' codec can't decode byte 0xc1 in position 50: invalid start byte,45036,closed,https://github.com/tensorflow/tensorflow/issues/45036
tf.keras.layers.LSTM don't check mask shape(tensorflow-gpu with cuda),45035,closed,https://github.com/tensorflow/tensorflow/issues/45035
setup.py is missing tblib dependency,45034,closed,https://github.com/tensorflow/tensorflow/issues/45034
tensorflow/lite/micro/tools/make/Makefile:403: *** Something went wrong with the flatbuffers download: .  Stop.,45033,open,https://github.com/tensorflow/tensorflow/issues/45033
Wheel repairing broken when using tensorflow/tensorflow:custom-op-gpu-ubuntu16 docker image,45032,open,https://github.com/tensorflow/tensorflow/issues/45032
[INTEL_MKL] Enable MatMul + Bias + LeakyRelu fusion,45031,closed,https://github.com/tensorflow/tensorflow/issues/45031
Request implementation of SSE regularization,45030,open,https://github.com/tensorflow/tensorflow/issues/45030
Update PCRE library from 8.42 to 8.44,45029,closed,https://github.com/tensorflow/tensorflow/issues/45029
CUDNN_STATUS_NOT_INITIALIZED error with tensorflow-gpu 2.4.0-rc2 RTX3070 CUDA11.0 cudnn8.0.2 windows10 and pip,45028,closed,https://github.com/tensorflow/tensorflow/issues/45028
Fixed typo in documentation,45027,closed,https://github.com/tensorflow/tensorflow/issues/45027
Reduce on MirroredVariable,45026,open,https://github.com/tensorflow/tensorflow/issues/45026
AttributeError: 'TFLiteConverter' object has no attribute 'target_spec',45025,closed,https://github.com/tensorflow/tensorflow/issues/45025
Could not create TensorFlow Graph: Not found: Op type not registered 'AddV2'  IOS,45024,closed,https://github.com/tensorflow/tensorflow/issues/45024
"Invalid argument:  assertion failed: [Unable to decode bytes as JPEG, PNG, GIF, or BMP]",45023,closed,https://github.com/tensorflow/tensorflow/issues/45023
[XLA] Lower TF/XLA overhead by creating less objects,45022,closed,https://github.com/tensorflow/tensorflow/issues/45022
execution_profile_test_with_xla_hlo_profile_cpu fails on s390x,45021,open,https://github.com/tensorflow/tensorflow/issues/45021
Building r2.3 branch fails on Windows 10 x64,45020,open,https://github.com/tensorflow/tensorflow/issues/45020
Error while loading .jpg images. Please help,45019,closed,https://github.com/tensorflow/tensorflow/issues/45019
Make open source CI closer to the internal tests.,45018,closed,https://github.com/tensorflow/tensorflow/issues/45018
Filling values when rotating an image using functions like tfa.image.rotate() and tfa.image.translate(),45017,closed,https://github.com/tensorflow/tensorflow/issues/45017
"Memory leak with tf.GradientTape, tf.while_loop and tf.function",45016,closed,https://github.com/tensorflow/tensorflow/issues/45016
Do not call tf.shape on a ragged tensor when computing losses.,45015,closed,https://github.com/tensorflow/tensorflow/issues/45015
Cannot use Hexagon delegate in Oneplus 6t. Failed to fetch Hexagon NN version. Not working since 18-Nov-2020.,45014,open,https://github.com/tensorflow/tensorflow/issues/45014
Test linking fails due to missing ldl,45013,open,https://github.com/tensorflow/tensorflow/issues/45013
Add s390x support for compiler related TCs,45012,closed,https://github.com/tensorflow/tensorflow/issues/45012
Cannot run GPU on tensorflow Docker Image with Tensorflow 2.3.1,45011,open,https://github.com/tensorflow/tensorflow/issues/45011
"Fix for TF Lite verifier, arg_min_max op and lsh_projection_test on Big Endian machine",45010,closed,https://github.com/tensorflow/tensorflow/issues/45010
TF Lite issue when loading a saved TF Lite model on platforms with different endianness,45009,open,https://github.com/tensorflow/tensorflow/issues/45009
Chinese docs on .org site should not link to .cn site,45008,closed,https://github.com/tensorflow/tensorflow/issues/45008
Mistakes in the documentation of UniqueWithCountsV2 API,45007,closed,https://github.com/tensorflow/tensorflow/issues/45007
Building custom op failed,45006,closed,https://github.com/tensorflow/tensorflow/issues/45006
Unable to perform subsampling using tf.data.Dataset map() method.,45005,open,https://github.com/tensorflow/tensorflow/issues/45005
2.4.0rc1 not supporting RTX 3090? #44969   Update efficientnet_weight_update_util.py,45004,closed,https://github.com/tensorflow/tensorflow/issues/45004
ResourceExhaustedError,45003,closed,https://github.com/tensorflow/tensorflow/issues/45003
Leak memory on ios,45002,closed,https://github.com/tensorflow/tensorflow/issues/45002
Error when trying to build from source on on CUDA 11 & Cudnn 8,45001,closed,https://github.com/tensorflow/tensorflow/issues/45001
Softnms,45000,closed,https://github.com/tensorflow/tensorflow/issues/45000
"I tried installing tensor flow 2 on new MacBook Air (M1), but getting this error ""zsh: illegal hardware instruction  python"" when I import it",44999,closed,https://github.com/tensorflow/tensorflow/issues/44999
[CherryPick:r2.4] add per_replica support for keras,44998,closed,https://github.com/tensorflow/tensorflow/issues/44998
"TensorFlow Lite error on iOS: ""Make sure you apply/link the Flex delegate before inference.""",44997,closed,https://github.com/tensorflow/tensorflow/issues/44997
"I strongly suspect that we are going to want a dedicated tosa-opt of some form eventually, but we don't need to start there if it is not convenient. We will eventually have a dedicated/minimal binary for importing from TFLite Flatbuffers at least, and I'm keeping an eye on how we can keep the build boundaries sufficient to meet that end.",44996,open,https://github.com/tensorflow/tensorflow/issues/44996
TF_RegisterLogListener in C API does not seem to work,44995,open,https://github.com/tensorflow/tensorflow/issues/44995
Doc py_function unknown shape,44994,closed,https://github.com/tensorflow/tensorflow/issues/44994
Include C logging API into part of the libtensorflow_framework.so,44993,closed,https://github.com/tensorflow/tensorflow/issues/44993
[Cherrypick:r2.4] add per_replica support for keras,44992,closed,https://github.com/tensorflow/tensorflow/issues/44992
[INTEL MKL] MKL DNN 0.x code clean -- pooling ops,44991,closed,https://github.com/tensorflow/tensorflow/issues/44991
tf-gpu 2.3.1 get initial low accuracy compare to tf-gpu 2.1,44990,closed,https://github.com/tensorflow/tensorflow/issues/44990
"ValueError: Cannot feed value of shape (1, 384, 513, 3) for Tensor",44989,closed,https://github.com/tensorflow/tensorflow/issues/44989
keras model fit with ragged tensors fails in LossesContainer.__call__,44988,closed,https://github.com/tensorflow/tensorflow/issues/44988
"Necessity of ""strategy.run"" and ""distribute_datasets_from_function"" for ParameterServers",44987,closed,https://github.com/tensorflow/tensorflow/issues/44987
Resource exhausted error when running tf.keras.Model.predict on large tensor,44986,open,https://github.com/tensorflow/tensorflow/issues/44986
xrt ops use bfc_allocator instead,44985,open,https://github.com/tensorflow/tensorflow/issues/44985
Incorrect error handling for invalid input names on SavedModel export,44984,open,https://github.com/tensorflow/tensorflow/issues/44984
tf.image.per_image_standardization unexpected behavior with unsigned integer input,44983,closed,https://github.com/tensorflow/tensorflow/issues/44983
TF Lite LSH Projection returns different results on Big Endian and Little Endian Machines,44982,closed,https://github.com/tensorflow/tensorflow/issues/44982
Gives error on dumping images to the tensorboard when training with TPU using gradient tape.,44981,closed,https://github.com/tensorflow/tensorflow/issues/44981
Changing self properties does not trigger retracing,44980,open,https://github.com/tensorflow/tensorflow/issues/44980
tf.keras.Model.fit() fails with RaggedTensor if using validation_split,44979,closed,https://github.com/tensorflow/tensorflow/issues/44979
error when compute gradients,44978,closed,https://github.com/tensorflow/tensorflow/issues/44978
What is the difference between two data generation methods？,44977,closed,https://github.com/tensorflow/tensorflow/issues/44977
```tf.distribute.MirroredStrategy``` is stuck.,44976,closed,https://github.com/tensorflow/tensorflow/issues/44976
Conversion to TFLite fails with 2.4.0-rc1,44975,closed,https://github.com/tensorflow/tensorflow/issues/44975
Error LNK2005 when linking in debug mode.,44974,open,https://github.com/tensorflow/tensorflow/issues/44974
"When training on the TPU, loss  is in PerReplica dictionary format. Any way to convert it in normal numpy/tensor format?",44973,closed,https://github.com/tensorflow/tensorflow/issues/44973
Moving average not supported in eager mode,44972,closed,https://github.com/tensorflow/tensorflow/issues/44972
Flexbuffers patching causing -Wnull-dereference,44971,closed,https://github.com/tensorflow/tensorflow/issues/44971
Why tf.data.Dataset.map() still unknown TensorShape?,44970,closed,https://github.com/tensorflow/tensorflow/issues/44970
2.4.0rc1 not supporting RTX 3090? ,44969,closed,https://github.com/tensorflow/tensorflow/issues/44969
TFLu: Move Ethos-U custom op out of AllOpsResolver,44968,closed,https://github.com/tensorflow/tensorflow/issues/44968
Why is the first inference Extremely Slow?,44967,closed,https://github.com/tensorflow/tensorflow/issues/44967
"tensorflow.python.framework.errors_impl.UnknownError:  Failed to get convolution algorithm. This is probably because cuDNN failed to initialize, so try looking to see if a warning log message was printed above",44966,closed,https://github.com/tensorflow/tensorflow/issues/44966
How to run TFLite on specific CPUs?,44965,closed,https://github.com/tensorflow/tensorflow/issues/44965
What does TODO(b/XXX) mean?,44964,closed,https://github.com/tensorflow/tensorflow/issues/44964
AttributeError: module 'tensorflow.keras.layers.experimental.preprocessing' has no attribute 'StringLookup'?,44963,closed,https://github.com/tensorflow/tensorflow/issues/44963
Add missing closing quotes for example in docstring,44962,closed,https://github.com/tensorflow/tensorflow/issues/44962
Quantization op for Reshape is not supported in keras,44961,open,https://github.com/tensorflow/tensorflow/issues/44961
Avoid call to cuCtxSynchronize() when moving from graph execution to eager execution,44960,closed,https://github.com/tensorflow/tensorflow/issues/44960
GeForce 3090 incompatibility with Nightly,44959,closed,https://github.com/tensorflow/tensorflow/issues/44959
[INTEL MKL] Added cpu docker file with python36.,44958,closed,https://github.com/tensorflow/tensorflow/issues/44958
TFLu - refactor apollo3 micro speech,44957,closed,https://github.com/tensorflow/tensorflow/issues/44957
"[Cherrypick:r2.4]Disables //tensorflow/python/kernel_tests/boosted_trees:[training_ops_test,prediction_ops_test,resource_ops_test] on Mac OS because of segfaults",44956,closed,https://github.com/tensorflow/tensorflow/issues/44956
TFLu - refactor apollo3 magic wand,44955,closed,https://github.com/tensorflow/tensorflow/issues/44955
TFLu - refactor apollo3 person detection,44954,closed,https://github.com/tensorflow/tensorflow/issues/44954
How does classifier predict a class?,44953,closed,https://github.com/tensorflow/tensorflow/issues/44953
Issue with tf.math.conj function,44952,closed,https://github.com/tensorflow/tensorflow/issues/44952
Disable failing macos tests,44951,closed,https://github.com/tensorflow/tensorflow/issues/44951
[Intel MKL] Fuse group of primitive ops for batch normalization to Fu…,44950,open,https://github.com/tensorflow/tensorflow/issues/44950
Fix small typos,44949,closed,https://github.com/tensorflow/tensorflow/issues/44949
Can't load GRUCell weights from TensorFlow 1 to TensorFlow 2,44948,closed,https://github.com/tensorflow/tensorflow/issues/44948
How to save a TensorFlow model to use in ML.NET,44947,closed,https://github.com/tensorflow/tensorflow/issues/44947
"ValueError: Shapes (None, 1) and (None, 10) are incompatible",44946,closed,https://github.com/tensorflow/tensorflow/issues/44946
[FIX ME!] Matrix computaion in custom-ops got partly correct result.,44945,closed,https://github.com/tensorflow/tensorflow/issues/44945
"tflite_runtime got installed successfully, however getting error while importing interpreter.",44944,open,https://github.com/tensorflow/tensorflow/issues/44944
UnrecognizedFlagError: Unknown command line flag 'pdb_post_mortem',44943,closed,https://github.com/tensorflow/tensorflow/issues/44943
Keras Model.compile() exception text is unclear when a loss method is not specified during compile(),44942,closed,https://github.com/tensorflow/tensorflow/issues/44942
Learn ML,44941,closed,https://github.com/tensorflow/tensorflow/issues/44941
TF 2.3.1. Custom Metrics are not shown,44940,closed,https://github.com/tensorflow/tensorflow/issues/44940
TFlu: Add unit test for multiple inputs,44939,closed,https://github.com/tensorflow/tensorflow/issues/44939
